{
  "record": "software_check_result",
  "schema_version": 1,
  "attempt": {
    "run_id": "run-0001",
    "node": {
      "graph_id": "review_pilot",
      "node_id": "cs_ci",
      "revision": 2
    },
    "number": 1
  },
  "subject": "patch_subject:sha256:29f2b2170924d2de17e891536f8511fecefecb0c7dac709a92c3f01f28e90b82",
  "candidate": {
    "kind": "commit",
    "commit": "266ec841a313476ea6cf2d7e453e490ae0585e54",
    "patch_digest": "sha256:cb6d53778ee066ce09befdca170120166e1b7b515e264ae03e732b16c8608dd7"
  },
  "base_commit": "1405df66cbe219b0bf6355bc3d60361a8376b6b4",
  "repository": {
    "root_commits": [
      "dc76e9f0c0006e8f919e0c515c66dbba3982f785"
    ]
  },
  "profile": {
    "id": "software_check",
    "version": 1,
    "digest": "sha256:8e6cb058d1cf01f7af9b76f9a7f749698072863e953ebc2a0f680432a0551220"
  },
  "environment": {
    "os": "windows",
    "arch": "x86_64"
  },
  "required_checks": [
    "fmt",
    "clippy",
    "test"
  ],
  "checks": [
    {
      "id": "fmt",
      "outcome": "passed",
      "duration_ms": 412,
      "stdout_digest": "sha256:e3b0c44298fc1c149afbf4c8996fb92427ae41e4649b934ca495991b7852b855",
      "stderr_digest": "sha256:e3b0c44298fc1c149afbf4c8996fb92427ae41e4649b934ca495991b7852b855",
      "exit_code": 0
    },
    {
      "id": "clippy",
      "outcome": "passed",
      "duration_ms": 3520,
      "stdout_digest": "sha256:e3b0c44298fc1c149afbf4c8996fb92427ae41e4649b934ca495991b7852b855",
      "stderr_digest": "sha256:82c2d7dec7fd4e5738b857b29d4edbe17ad1b971f9404e8b35b71db11f4e1b6c",
      "exit_code": 0
    },
    {
      "id": "test",
      "outcome": "passed",
      "duration_ms": 9114,
      "stdout_digest": "sha256:be07ddbfa81dd83a333ce52f35cbc548109b07d49073064d18b5c56e7c64def1",
      "stderr_digest": "sha256:e3b0c44298fc1c149afbf4c8996fb92427ae41e4649b934ca495991b7852b855",
      "exit_code": 0
    }
  ],
  "conclusion": "accept"
}
